{
  "schema": "m4_sample_input_v1",
  "sample_id": "sample_001",
  "shape_name": "classic",
  "parameters": {
    "top_wood_id": "mahogany",
    "back_wood_id": "mahogany",
    "geometry.length": 0.3601257286159384,
    "geometry.width": 0.23979975311361468,
    "geometry.depth": 0.10834781501051131,
    "geometry.top_thickness": 0.0031691636120430777,
    "geometry.back_thickness": 0.003486079973247386,
    "geometry.hole_radius": 0.0445809551562789
  },
  "requires_mesh_regeneration": true,
  "selection_reason": "m4_schema_example_lhs_row"
}
